{
  "schema": "open-real2sim.env.manifest/0.1",
  "id": "env:you/bedroom-phone-scan@0.1.0",
  "name": "Bedroom phone scan",
  "summary": "Indoor bedroom, handheld RGB(+depth).",
  "category": "home_indoor",
  "created_at": "2026-09-21T17:00:00Z",
  "license": {
    "code": "CC-BY-4.0",
    "url": null,
    "notes": "No PII / faces unblurred."
  },
  "attribution": {
    "contributors": [
      {
        "name": "Site Owner",
        "role": "scene_owner",
        "contact": "",
        "share": 0.5
      },
      {
        "name": "Sam",
        "role": "capture",
        "contact": "https://github.com/sam",
        "share": 0.5
      }
    ],
    "derived_from": []
  },
  "capture": {
    "session_id": "00000000-0000-4000-8000-000000000001",
    "schema": "open-real2sim.capture.manifest/0.1",
    "capture_mode": "android",
    "capture_device_class": "handheld_phone",
    "package": {
      "path": "../captures/session_00000000-0000-4000-8000-000000000001/",
      "uri": null
    },
    "session_mcap_sha256": "aaaaaaaaaaaaaaaaaaaaaaaaaaaaaaaaaaaaaaaaaaaaaaaaaaaaaaaaaaaaaaaa",
    "purpose": "scene",
    "duration_s": 42.0,
    "created_at": "2026-09-21T16:50:00Z",
    "streams_present": ["rgb", "depth", "imu"],
    "calibration": {
      "rig_id": "phone_default",
      "method": "factory"
    }
  },
  "assets": {
    "visual": { "format": "3dgs", "path": "assets/visual/" },
    "collision": { "format": "mesh_urdf", "path": "assets/collision/" },
    "semantics": { "format": "openusd_labels", "path": "assets/semantics/", "optional": true },
    "previews": {
      "point_cloud_thumb": "assets/preview_pc.jpg",
      "depth_thumb": "assets/preview_depth.jpg",
      "photoreal_still": "assets/preview_rgb.jpg"
    }
  },
  "sim": {
    "targets": ["isaac_lab", "mujoco"],
    "units": "meters",
    "up_axis": "z",
    "origin": "capture_rig"
  },
  "quality": {
    "status": "draft",
    "tags": [],
    "gates_passed": [],
    "notes": "example stub for local validate/publish smoke"
  },
  "rewards_hooks": {
    "enabled": false,
    "scheme": null,
    "reputation_weight": null
  }
}
